Name,Filter,Category,Tags,Text,Status
Кибербезопастность,"Бесплатно либо очень низкие затраты, Интеллектуально цепляющее, Креативное, Легко начать, Не выходя из дома, Соревновательное",Другое,"приключенчество, самопроявление, слава","Мы думаем, что в интернете мы в безопасности, что у нас надёжные пароли, что домашний вай-фай защищён, но по факту это не так

Разбирание в кибербезопастности поможет понять насколько мы незащищены используя технологии и понимать где что как может пойти не так, предохраняясь от неприятных ситуаций

Вот замечательный канал, где хакер показывает как у всех всё взламывает
https://www.youtube.com/@overbafer1

Если захочется самостоятельно пощупать как это работает, то есть замечательные англоязычные сайты, которые обьясняют хакинг и защиту от него: https://www.hacker101.com/start-here/ https://tryhackme.com// https://www.hackthebox.com/",Done
Баскетбол,"Активное, Бесплатно либо очень низкие затраты, Вне дома, Интеллектуально цепляющее, Соревновательное, Социальное",Игры и спорт,"лидерство, приключенчество, слава",Правила -[ https://www.youtube.com/watch?v=wYjp2zoqQrs&ab_channel=NinhLy],Done
Дартс,"Активное, Бесплатно либо очень низкие затраты, Вне дома, Не выходя из дома, Расслабляющее, Соревновательное, Социальное",Игры и спорт,"приключенчество, слава","Дартс крайне популярен с пабах Англии, США, но не стоит списывать его на простую игру

При таком минимализме движений на главные позиции выходит техника и способность психически держаться продолжая верить в себя

[Правила и история игры](https://www.youtube.com/watch?v=7uFulilgL3Q&ab_channel=GalileoRU)

Где же поиграть?
Наверняка в нескольких пабах твоего города есть дартс. Нужно о них узнать и пойти поиграть с друзьями. Если станет понятно, что хочется продолжать - можно скинуться и купить доску с дротиками

Тренировки
Если поставить в комнате, то можно проходя мимо тренероваться по 10 минут в день. В интернете можно найти много хороших видео и [статей по технике и тренbровкам](https://cubes.in.ua/ua/pravilnaya-tehnika-broska-v-darts-kak-trenirovatsya/)

Дальнейшее развитие - в дартсе правила “501” это лишь самый популярный вариант игры, есть ещё огромное кол-во, которые можно попробовать. Также со временем можно попробовать пойти на турниры, если того захочется",Done
3D-моделирование (+ печать),"Интеллектуально цепляющее, Креативное, Не выходя из дома",Искусство и мастерение,"знания, самопроявление","3Дмоделирование позволяет тебе стать мини-заводом. Можно создавать очень много чего для себя и знакомых: спроектировать мебель идеальную для своего дома, можно свои настольные игры/дополнения, тут каждый ограничивается своими пожеланиями

Печать популярна, в каждом городе есть по 2-3 3д шопа для покупки пластика и принтера.
Есть два вида принтеров FDM и SLA:FDM - наиболее популярный и дешёвый
SLA - дорогой, но более точный
Нет смысла покупать 3д принтер, легче просто заказывать смоделированные изделия гугля “3д печать украина”

С 3Дпринтером понятно, а что касается непластмассовых вещей, например хочу сделать под себя стол? Всё очень похоже: на завод даешь размеры деталий указав материал из каталога и тебе качественно изготавливают дощечки, а потом собираешь как конструктор

Не обязательно даже уметь моделировать, можно просто скачивать бесплатные модели с интернета - https://www.thingiverse.com/

А если хочу моделировать?
https://www.thingiverse.com/ - понятный классный сайт для моделирования
https://www.youtube.com/watch?v=Ucs2lRjHbaE

",Done
Велик,"Активное, Вне дома, Расслабляющее",Игры и спорт,"приключенчество, слава","Супер)
Велосипед - это не только быстрое средство передвижения, но и здоровый образ жизни и мощный источник адреналина. Достань свой велик/ выпроси у кого-то с знакомых, выбери удобную малолюдную трассу и вперёд. [Гайд по важным моментам](https://xage.ru/velosport-rukovodstvo-dlya-nachinayuschih/)

Со временем, если станет понятно, что хочется развиваться, то можно смотреть в ютубе уроки по технике и подключиться к местной группе любителей покататься",Done
Скручивание воздушных шаров 🤡,"Бесплатно либо очень низкие затраты, Вне дома, Креативное, Не выходя из дома, Расслабляющее",Исполнительское искусство,"помогахерство, самопроявление, слава","Да, это специфическое занятие, но возможно тебе хочется попробовать. Особенно, если любишь детей и будешь рад их порадовать 

[Обучение](https://ru.wikihow.com/%D0%BC%D0%BE%D0%B4%D0%B5%D0%BB%D0%B8%D1%80%D0%BE%D0%B2%D0%B0%D1%82%D1%8C-%D0%B6%D0%B8%D0%B2%D0%BE%D1%82%D0%BD%D1%8B%D1%85-%D0%B8%D0%B7-%D0%B2%D0%BE%D0%B7%D0%B4%D1%83%D1%88%D0%BD%D1%8B%D1%85-%D1%88%D0%B0%D1%80%D0%B8%D0%BA%D0%BE%D0%B2). Шары можно купить в карнавальном магазе/сайте. Называются “шары для моделирования” + хорошо бы купить за 1-2$ насосик, чтобы в рот ничего не попадало

Из шариков можно сделать не только собачку. Есть невероятное кол-во вариантов. [Классный канал с большим кол-вом обьяснений](https://www.youtube.com/@Balloonanimals1)",Done
Покер,"Бесплатно либо очень низкие затраты, Интеллектуально цепляющее, Креативное, Легко начать, Не выходя из дома, Соревновательное, Социальное",Игры и спорт,"приключенчество, слава","Человек, не разбирающийся в покере считает покер игрой на удачу. Как же это далеко от правды)))

Покер интеллектуально намного сложнее шахмат, в нём недостаточно просчётов и знаний комбинаций, огромное значение имеет понимание человеческой природы и умение её применять

[Правила](https://www.youtube.com/watch?v=JLAi4XxF6dk&ab_channel=%D0%9F%D0%BE%D0%BA%D0%B5%D1%80%D1%81%D1%82%D1%80%D0%B8%D0%BC%D1%8B%D0%BE%D1%82Cardmates)
Для закрепления правил советую скачать на телефон любую бесплатную покерную игру, где фишки не стоят денег. Со временем можно позвать друзей вживую поиграть, объяснив им правила. Если увлечёшься, то начнёшь смотреть уроки на ютубе. Надеюсь тебе понравится эта замечательная игра, но настоящие деньги советую не ставить",Done
Язык жестов,"Бесплатно либо очень низкие затраты, Интеллектуально цепляющее, Легко начать, Не выходя из дома, Социальное",Другое,"знания, помогахерство","В этом мире более 70 миллионов глухих хороших людей. Возможно у тебя есть такие знакомые и тебе бы хотелось без переводчика общаться с ними. А возможно тебе просто интересно посмотреть как работает язык жестов

Тут есть одна сложность - существует более 300 языков жестов 🤯
Если у тебя глухой знакомый - спроси какой из языков тебе учить
Если же интересно чисто для себя - можно взять International Sign - международный язык жестов

Как учить? Просто открывай уроки по языку в ютубе/ТикТоке и во время просмотра видео повторяй руками, чтобы запоминать, очень многие слова быстро запомнятся, так как интуитивны и играя в крокодила ты бы делал(-а) также",Done
Нейробиология (Как работает мозг),"Бесплатно либо очень низкие затраты, Интеллектуально цепляющее, Не выходя из дома, Расслабляющее",Другое,"защищённость, знания","Наши мозги - удивительно сложные строения, в которых хранятся все наши чувства, знания да и наша личность, то есть мы сами 🙂

Но как мозг работает? Из чего состоит? Чем мы ему вредим, а чем можем помогать? В этом и поможет разобраться нейробиология. Номер 1 в этой теме - Вячеслав Дубынин. Можно смотреть его самые простые популярные видео, можно плейлисты для продвинутых, а если совсем захочется вкапаться, то можно посмотреть его лекции для студентов нейробиологов

[Начать можно от сюда например](https://www.youtube.com/watch?v=Oqt6TWvaeew&ab_channel=%D0%93%D0%BB%D0%B5%D0%B1%D0%A1%D0%BE%D0%BB%D0%BE%D0%BC%D0%B8%D0%BD)
или [про сон послушать](https://www.youtube.com/watch?v=u-nyDCGcJ3M&ab_channel=%D0%93%D1%80%D1%83%D0%BF%D0%BF%D0%B0%D0%9A%D0%BE%D0%BC%D0%BF%D0%B0%D0%BD%D0%B8%D0%B9%D0%AD%D0%A4%D0%9A%D0%9E)",Done
Фехтование/ LARP,"Активное, Вне дома, Соревновательное, Социальное",Игры и спорт,"лидерство, приключенчество, слава","Ух ты
Серьёзное заявление)

Глобально, фехтование бывает [спортивное (там где набивание очков)](https://www.youtube.com/watch?v=D-3zbKHsI0g&ab_channel=%D0%A4%D0%B5%D1%85%D1%82%D0%BE%D0%B2%D0%B0%D0%BD%D0%B8%D0%B5%D0%94%D0%BD%D0%B5%D0%BF%D1%80) и историческое (как на самом деле бились). Если тебе хочется спорта - нужно поискать в своём городе секцию и пойти на спортивное. Если хочется именно [реалистичного фехтования](https://www.youtube.com/watch?v=xYxQR5haqTs&ab_channel=BuhurtTech) (или псевдореалистичного) то тут тебе будут интересны LARP (ролевые игры за рыцарей, пиратов, фентези, …)

[Вот топовый канал киевлянина, на котором есть всё о LARP](https://www.youtube.com/watch?v=R3hYfY0pRoU&ab_channel=Ролевойвестник) (основы фехтования, как найти команды да и как смастерить себе безопасные красивые мячи и броню)

Если в твоём городе не окажется никакой фехтовальной движухи, что вполне вероятно, то можно просто купить 2 меча для тренировки фехтованию (они мягкие) и безопасно рубиться с друзьями как хочется. Стоят они от 5 до 20$ и можно легко передарить. Если вам с друзьями понравится, можете учить с ютуба технику (стилей много, поэтому конкретный канал советовать не буду)",Done
Канатоходство (Слэклайн),"Активное, Вне дома, Расслабляющее, Соревновательное",Игры и спорт,"лидерство, приключенчество","Любил(-а) в детстве ходить по бордюрам?)
Если да, советую попробовать то же, только уже на более серьёзном уровне - слэклайн. Это канат, который удобно зацепить между двумя деревьями в парке и тренироваться. Бывают 15 и 25м. Стоят до 100$, но неубиваемая вещь, которую можно брать с друзьями на пикники 

[Инструкция по установке и обучение канатоходству](https://www.youtube.com/watch?v=dhoHwWhG4P8&ab_channel=GoProSport)
[Плюс можно посмотреть как выглядит канатоходство на чемпионате мира](https://www.youtube.com/watch?v=4MYQ4M5Z1FQ&ab_channel=DannyStrasser)",Done